{
  "schemaVersion": 1,
  "id": "Commander.Karax",
  "type": "CommanderDataCenter",
  "gameDataEntry": "Base.SC2Data/GameData.xml",
  "migrationStatus": "complete",
  "spaces": [
    {
      "path": "GameData/UnitData_Karax.xml",
      "owns": [
        "CUnit"
      ],
      "catalogIds": [
        "SoACasterKarax"
      ]
    }
  ],
  "exports": {
    "units": [
      "SoACasterKarax"
    ]
  }
}
