{
  "schemaVersion": 1,
  "id": "Commander.Raynor",
  "type": "CommanderDataCenter",
  "gameDataEntry": "Base.SC2Data/GameData.xml",
  "migrationStatus": "complete",
  "spaces": [
    {
      "path": "GameData/AbilData_Raynor.xml",
      "owns": [
        "CAbil"
      ],
      "catalogIds": [
        "RaynorCommandoMarineHangar"
      ]
    },
    {
      "path": "GameData/UnitData_Raynor.xml",
      "owns": [
        "CUnit"
      ],
      "catalogIds": [
        "CoopAssistCasterRaynor",
        "CoopCasterRaynor",
        "MutatorAmonRaynor",
        "Raynor",
        "Raynor01",
        "RaynorCommando",
        "RaynorCommandoMarine",
        "RaynorLab",
        "RaynorsRaidersDropship",
        "Barracks",
        "Factory",
        "Starport",
        "SCVRaynor",
        "MarineRaynor",
        "MedicRaynor",
        "FirebatRaynor",
        "MarauderRaynor",
        "VultureRaynor",
        "SiegeTankRaynor",
        "SiegeTankSiegedRaynor",
        "VikingRaynor",
        "VikingAssaultRaynor",
        "BansheeRaynor",
        "BattlecruiserRaynor",
        "CommandCenterRaynor",
        "OrbitalCommandRaynor",
        "BarracksRaynor",
        "FactoryRaynor",
        "StarportRaynor",
        "CommandCenterFlyingRaynor",
        "OrbitalCommandFlyingRaynor",
        "BarracksFlyingRaynor",
        "FactoryFlyingRaynor",
        "StarportFlyingRaynor",
        "TechLabRaynor",
        "ReactorRaynor",
        "BarracksTechLabRaynor",
        "BarracksReactorRaynor",
        "FactoryTechLabRaynor",
        "FactoryReactorRaynor",
        "StarportTechLabRaynor",
        "StarportReactorRaynor",
        "SupplyDepotRaynor",
        "RefineryRaynor",
        "EngineeringBayRaynor",
        "BunkerRaynor",
        "MissileTurretRaynor",
        "SensorTowerRaynor",
        "ArmoryRaynor",
        "FusionCoreRaynor"
      ]
    }
  ],
  "exports": {
    "units": [
      "CoopAssistCasterRaynor",
      "CoopCasterRaynor",
      "MutatorAmonRaynor",
      "Raynor",
      "Raynor01",
      "RaynorCommando",
      "RaynorCommandoMarine",
      "RaynorLab",
      "RaynorsRaidersDropship",
      "Barracks",
      "Factory",
      "Starport",
      "SCVRaynor",
      "MarineRaynor",
      "MedicRaynor",
      "FirebatRaynor",
      "MarauderRaynor",
      "VultureRaynor",
      "SiegeTankRaynor",
      "SiegeTankSiegedRaynor",
      "VikingRaynor",
      "VikingAssaultRaynor",
      "BansheeRaynor",
      "BattlecruiserRaynor",
      "CommandCenterRaynor",
      "OrbitalCommandRaynor",
      "BarracksRaynor",
      "FactoryRaynor",
      "StarportRaynor",
      "CommandCenterFlyingRaynor",
      "OrbitalCommandFlyingRaynor",
      "BarracksFlyingRaynor",
      "FactoryFlyingRaynor",
      "StarportFlyingRaynor",
      "TechLabRaynor",
      "ReactorRaynor",
      "BarracksTechLabRaynor",
      "BarracksReactorRaynor",
      "FactoryTechLabRaynor",
      "FactoryReactorRaynor",
      "StarportTechLabRaynor",
      "StarportReactorRaynor",
      "SupplyDepotRaynor",
      "RefineryRaynor",
      "EngineeringBayRaynor",
      "BunkerRaynor",
      "MissileTurretRaynor",
      "SensorTowerRaynor",
      "ArmoryRaynor",
      "FusionCoreRaynor"
    ]
  }
}
