{
  "schemaVersion": 1,
  "id": "Commander.Mengsk",
  "type": "CommanderDataCenter",
  "gameDataEntry": "Base.SC2Data/GameData.xml",
  "migrationStatus": "complete",
  "spaces": [
    {
      "path": "GameData/UnitData_Mengsk.xml",
      "owns": [
        "CUnit"
      ],
      "catalogIds": [
        "MengskFirebat",
        "MengskMarauder",
        "MengskMarine",
        "MengskMedic",
        "MengskReaper"
      ]
    }
  ],
  "exports": {
    "units": [
      "MengskFirebat",
      "MengskMarauder",
      "MengskMarine",
      "MengskMedic",
      "MengskReaper"
    ]
  }
}
