{
  "schemaVersion": 1,
  "id": "Commander.Vorazun",
  "type": "CommanderDataCenter",
  "gameDataEntry": "Base.SC2Data/GameData.xml",
  "migrationStatus": "complete",
  "spaces": [
    {
      "path": "GameData/UnitData_Vorazun.xml",
      "owns": [
        "CUnit"
      ],
      "catalogIds": [
        "SoACasterVorazun"
      ]
    }
  ],
  "exports": {
    "units": [
      "SoACasterVorazun"
    ]
  }
}
