{
  "schemaVersion": 1,
  "id": "Commander.Horner",
  "type": "CommanderDataCenter",
  "gameDataEntry": "Base.SC2Data/GameData.xml",
  "migrationStatus": "complete",
  "spaces": [
    {
      "path": "GameData/AbilData_Horner.xml",
      "owns": [
        "CAbil"
      ],
      "catalogIds": [
        "HHBuild",
        "HHStarportTrainHorner",
        "HHMercStarportMorph",
        "SummonHornerMercenaries"
      ]
    },
    {
      "path": "GameData/UnitData_Horner.xml",
      "owns": [
        "CUnit"
      ],
      "catalogIds": [
        "CoopCasterHorner"
      ]
    }
  ],
  "exports": {
    "units": [
      "CoopCasterHorner"
    ]
  }
}
