{
  "schemaVersion": 1,
  "id": "Commander.Artanis",
  "type": "CommanderDataCenter",
  "gameDataEntry": "Base.SC2Data/GameData.xml",
  "migrationStatus": "complete",
  "spaces": [
    {
      "path": "GameData/UnitData_Artanis.xml",
      "owns": [
        "CUnit"
      ],
      "catalogIds": [
        "ArtanisReviveBeacon",
        "SoACasterArtanis"
      ]
    }
  ],
  "exports": {
    "units": [
      "ArtanisReviveBeacon",
      "SoACasterArtanis"
    ]
  }
}
