{
  "schemaVersion": 1,
  "id": "Capability.NeuroBridge7vs1",
  "type": "CapabilityDataCenter",
  "gameDataEntry": "Base.SC2Data/GameData.xml",
  "migrationStatus": "complete",
  "spaces": [],
  "exports": {
    "units": [],
    "upgrades": [],
    "buttons": [],
    "requirements": []
  },
  "imports": {
    "capabilities": [
      "NeuroIntegration"
    ],
    "dataCenters": []
  },
  "galaxyRuntime": {
    "libFile": "LibNeuroBridge7vs1.galaxy",
    "initFunction": "libNeuroBridge7vs1_InitLib"
  }
}
