{
  "schemaVersion": 1,
  "id": "Commander.AlengerCommon",
  "type": "CommanderDataCenter",
  "gameDataEntry": "Base.SC2Data/GameData.xml",
  "migrationStatus": "complete",
  "spaces": [
    {
      "path": "GameData/ActorData.xml",
      "owns": [
        "CActor"
      ],
      "catalogIds": [
        "0suanxingBuffStructure",
        "0heidongMedium",
        "0suanxingBuff",
        "0hefusheSmall",
        "0hefusheMedium",
        "0hefusheBuff",
        "0heidongLarge",
        "0heidongSmall",
        "0chixuranshaoBuff",
        "0chixuranshaoBuffStructure",
        "0dianranUnitImpact",
        "0hedanExplodeLarge",
        "0hedanExplodeMedium",
        "0hedanExplodeSmall",
        "0hedanFoliageFXSpawnerLarge",
        "0hedanFoliageFXSpawnerMedium",
        "0hedanFoliageFXSpawnerSmall",
        "0hedanTreeKillerLarge",
        "0hedanTreeKillerMedium",
        "0hedanTreeKillerSmall",
        "0hedanShieldHitter",
        "0heidongbirthsound",
        "0heidongdeathsound",
        "0heidongloopsound",
        "0kengdaochongBirth",
        "0kengdaochongDeathCry",
        "0weizhicaozuozheyue",
        "0kengdaochong"
      ]
    },
    {
      "path": "GameData/BehaviorData.xml",
      "owns": [
        "CBehavior"
      ],
      "catalogIds": [
        "0fangzhiyichu",
        "0heidongshikongniuqu162",
        "0heidongshikongniuqu18",
        "0heidongshikongniuqu9",
        "0suanxing",
        "0chixuranshao",
        "0hefushe",
        "0heidongshikongniuqu1",
        "0heidongshikongniuqu5",
        "0heidongshikongniuqu10",
        "0heidongshikongniuqu6",
        "0heidongshikongniuqu3",
        "0heidongshikongniuqu2",
        "0heidongshikongniuqu12",
        "0heidongshikongniuqu7",
        "0heidongshikongniuqu4",
        "0heidongshikongniuqu14",
        "0heidongshikongniuqu8",
        "0heidongshikongniuqu20",
        "0suanxingyichu",
        "0yichongjianzhushengminghuifu",
        "0dianran",
        "0leida",
        "7zhence12",
        "7zhence9",
        "0juntanyuanS",
        "0juntanyuanSmall",
        "0juntanyuanLarge",
        "0juntanyuanMedium",
        "0juntanyuan",
        "0fuhuayouchong1",
        "0fuhuayouchong2",
        "0fuhuayouchong3"
      ]
    },
    {
      "path": "GameData/EffectData.xml",
      "owns": [
        "CEffect"
      ],
      "catalogIds": [
        "00hefusheApply",
        "0dianranApply",
        "0heidongshikongniuquApply18",
        "0heidongshikongniuquApply20",
        "0heidongshikongniuquapply9",
        "0suanxingyichuApply",
        "0chixuranshaoApply",
        "0suanxingApply",
        "0heidongshikongniuquapply1",
        "0heidongshikongniuquapply5",
        "0heidongshikongniuquApply10",
        "0heidongshikongniuquApply6",
        "0heidongshikongniuquapply3",
        "0heidongshikongniuquApply2",
        "0heidongshikongniuquApply12",
        "0heidongshikongniuquapply7",
        "0heidongshikongniuquApply4",
        "0heidongshikongniuquApply14",
        "0heidongshikongniuquApply8",
        "0heidongshikongniuquApply16",
        "0chaojiheidongdamage9",
        "0chaojiheidongdamage10",
        "0hedanDamageLarge",
        "0heidongMediumDamage5",
        "0heidongModifyDamage1",
        "0heidongSmallDamage5",
        "0heidongSmallModifyDamage12",
        "0heidongSmallModifyDamage2",
        "0heidongModifyDamage2",
        "0heidongModifyDamage3",
        "0heidongSmallModifyDamage32",
        "0heidongModifyDamage4",
        "0heidongSmallModifyDamage42",
        "0heidongModifyDamage5",
        "0heidongMediumDamage1",
        "0heidongMediumDamage2",
        "0heidongMediumDamage3",
        "0heidongMediumDamage4",
        "0heidongSmallModifyDamage52",
        "0chaojiheidongdamage1",
        "0chaojiheidongdamage5",
        "0chaojiheidongdamage6",
        "0chaojiheidongdamage3",
        "0chaojiheidongdamage2",
        "0chaojiheidongdamage7",
        "0chaojiheidongdamage4",
        "0chaojiheidongdamage8",
        "0chixuranshaoDamage",
        "0suanxingDamage",
        "0hedanDamageMedium",
        "0hedanDamageSmall",
        "0hedanyoushangDamageMedium",
        "0hefushedamage",
        "0heidongSmallDamage1",
        "0heidongSmallDamage2",
        "0heidongSmallDamage3",
        "0heidongSmallDamage4",
        "0dianranDamage",
        "0hedanSetLarge",
        "0hedanSetMedium",
        "0hedanSetSmall",
        "0hedanFireSearchLarge",
        "0heidongSearchLarge",
        "0heidongSearchMedium",
        "0hedanFireSearchMedium",
        "0hedanFireSearchSmall",
        "0hefusheSearchMedium",
        "0hefusheSearchSmall",
        "0xiaheidongSearchSmall",
        "0hefushePersistentLarge",
        "0heidongLargeDamagePersistent2",
        "0heidongLargeDamagePersistent3",
        "0heidongLargeDamagePersistent4",
        "0heidongLargeDamagePersistent5",
        "0heidongLargeDamagePersistent6",
        "0heidongLargeDamagePersistent7",
        "0heidongLargeDamagePersistent8",
        "0heidongLargeDamagePersistent9",
        "0heidongLargeDamagePersistent10",
        "0heidongMediumDamagePersistent1",
        "0heidongLargeDamagePersistent1",
        "0heidongMediumDamagePersistent2",
        "0heidongMediumDamagePersistent3",
        "0heidongMediumDamagePersistent4",
        "0heidongMediumDamagePersistent5",
        "0heidongSmallDamagePersistent2",
        "0heidongSmallDamagePersistent3",
        "0heidongSmallDamagePersistent4",
        "0heidongSmallDamagePersistent5",
        "0heidongPersistentMedium",
        "0heidongPersistentLarge",
        "0hefushePersistentMedium",
        "0hefushePersistentSmall",
        "0heidongSmallDamagePersistent1",
        "0heidongPersistentSmall",
        "0suanxingRemove",
        "0yichongjianzhushengminghuifuModify"
      ]
    },
    {
      "path": "GameData/FootprintData.xml",
      "owns": [
        "CFootprint"
      ],
      "catalogIds": [
        "0jianzhujuntanfangzhi4",
        "0jianzhujuntanzuyinfangzhi1",
        "0jianzhujuntanzuyinkongzhi1",
        "0jianzhujuntanzuyinkongzhi4",
        "0juntanLarge",
        "0juntanSmall",
        "0juntanMedium",
        "0juntanStart",
        "0jianzhujuntanfangzhi5",
        "0jianzhujuntanzuyinkongzhi5",
        "0jianzhujuntanzuyinfangzhi3",
        "0jianzhujuntanzuyinkongzhi3",
        "0jianzhujuntanzuyinfangzhi2",
        "0jianzhujuntanzuyinkongzhi2"
      ]
    },
    {
      "path": "GameData/ModelData.xml",
      "owns": [
        "CModel"
      ],
      "catalogIds": [
        "0hedanExplodeSmall",
        "0hedanExplodeMedium",
        "0hedanExplodeLarge",
        "0hefusheSmall",
        "0hefusheMedium",
        "0heidongMedium",
        "0chixuranshaoBuff",
        "0heidongLarge",
        "0heidongSmall",
        "0suanxingBuff",
        "0hefusheBuff",
        "6dianranUnitImpact"
      ]
    },
    {
      "path": "GameData/UnitData.xml",
      "owns": [
        "CUnit"
      ],
      "catalogIds": [
        "0kengdaochong"
      ]
    },
    {
      "path": "GameData/ValidatorData.xml",
      "owns": [
        "CUnit"
      ],
      "catalogIds": []
    }
  ],
  "exports": {
    "units": [
      "0kengdaochong"
    ]
  }
}
