{
  "schemaVersion": 1,
  "id": "Commander.Zagara",
  "type": "CommanderDataCenter",
  "gameDataEntry": "Base.SC2Data/GameData.xml",
  "migrationStatus": "complete",
  "spaces": [
    {
      "path": "GameData/UnitData_Zagara.xml",
      "owns": [
        "CUnit"
      ],
      "catalogIds": [
        "BileLauncherZagara",
        "ZaGara",
        "ZagaraCorruptor",
        "ZagaraReviveCocoon",
        "ZagaraVoidCoop",
        "ZagaraVoidCoopBurrowed",
        "ZagaraVoidCoopDevouringMaw"
      ]
    }
  ],
  "exports": {
    "units": [
      "BileLauncherZagara",
      "ZaGara",
      "ZagaraCorruptor",
      "ZagaraReviveCocoon",
      "ZagaraVoidCoop",
      "ZagaraVoidCoopBurrowed",
      "ZagaraVoidCoopDevouringMaw"
    ]
  }
}
