{
  "schemaVersion": 1,
  "id": "Commander.Stukov",
  "type": "CommanderDataCenter",
  "gameDataEntry": "Base.SC2Data/GameData.xml",
  "migrationStatus": "complete",
  "spaces": [
    {
      "path": "GameData/UnitData_Stukov.xml",
      "owns": [
        "CUnit"
      ],
      "catalogIds": [
        "CoopCasterStukov",
        "InfestedStukovCoopBurrowed",
        "StukovAleksander",
        "StukovApocalisk",
        "StukovInfestedSiegeTank",
        "StukovInfestedSiegeTankImpalerTentacle",
        "StukovInfestedSiegeTankUprooted",
        "StukovReviveCocoon",
        "InfestedStukovCoop"
      ]
    }
  ],
  "exports": {
    "units": [
      "CoopCasterStukov",
      "InfestedStukovCoopBurrowed",
      "StukovAleksander",
      "StukovApocalisk",
      "StukovInfestedSiegeTank",
      "StukovInfestedSiegeTankImpalerTentacle",
      "StukovInfestedSiegeTankUprooted",
      "StukovReviveCocoon",
      "InfestedStukovCoop"
    ]
  }
}
