{
  "$schema": "../scripts/sc2-composer/schema/DataCenter.schema.json",
  "schemaVersion": 1,
  "id": "Platform.SibirensStarhooksCommon",
  "type": "PlatformDataCenter",
  "gameDataEntry": "mpq-internal",
  "migrationStatus": "complete",
  "spaces": [],
  "containerType": "mpq",
  "closureRole": "common"
}
