{
  "schemaVersion": 1,
  "id": "Commander.Kerrigan",
  "type": "CommanderDataCenter",
  "gameDataEntry": "Base.SC2Data/GameData.xml",
  "migrationStatus": "complete",
  "spaces": [
    {
      "path": "GameData/AbilData_Kerrigan.xml",
      "owns": [
        "CAbil"
      ],
      "catalogIds": [
        "LarvaTrainKerrigan",
        "MorphHydraliskToLurkerKerrigan",
        "TrainQueenKerrigan",
        "MutaliskMorphToBroodLordKerrigan",
        "UpgradeToGreaterSpireKerrigan"
      ]
    },
    {
      "path": "GameData/ActorData_Kerrigan.xml",
      "owns": [
        "CActor"
      ],
      "catalogIds": [
        "HydraliskKerrigan",
        "HydraliskLurkerKerrigan",
        "HydraliskLurkerBurrowedKerrigan",
        "UltraliskKerrigan",
        "BroodLordKerrigan",
        "BroodLordCocoonKerrigan"
      ]
    },
    {
      "path": "GameData/BehaviorData_Kerrigan.xml",
      "owns": [
        "CBehavior"
      ],
      "catalogIds": [
        "CommanderPrestigeKerriganAbilitiesFuryExpend",
        "CommanderPrestigeKerriganAbilitiesStun"
      ]
    },
    {
      "path": "GameData/EffectData_Kerrigan.xml",
      "owns": [
        "CEffect"
      ],
      "catalogIds": [
        "CommanderPrestigeKerriganAbilitiesExhaust",
        "CommanderPrestigeKerriganAbilitiesRemoveFury",
        "CommanderPrestigeKerriganAbilitiesExpendSet",
        "CommanderPrestigeKerriganAbilitiesExpendSet2",
        "CommanderPrestigeKerriganAbilitiesExpendSet3",
        "CommanderPrestigeKerriganAbilitiesExpendSet4",
        "CommanderPrestigeKerriganAbilitiesExpendSet5",
        "PsiStrikeWalk",
        "CommanderPrestigeKerriganAbilitiesStunSet",
        "CommanderPrestigeKerriganAbilitiesFuryExpendX2",
        "CommanderPrestigeKerriganAbilitiesFuryExpendX3",
        "CommanderPrestigeKerriganAbilitiesFuryExpendX4",
        "CommanderPrestigeKerriganAbilitiesFuryExpendX5",
        "CommanderPrestigeKerriganAbilitiesFuryExpend",
        "CommanderPrestigeKerriganAbilitiesStun",
        "CommanderPrestigeKerriganAbilitiesCP",
        "CommanderPrestigeKerriganAbilitiesConvertRage",
        "CommanderPrestigeKerriganAbilitiesDamage",
        "CommanderPrestigeKerriganAbilitiesStunSearchParent",
        "CommanderPrestigeKerriganAbilitiesStunSearch",
        "CommanderPrestigeKerriganAbilitiesStunSearch2",
        "CommanderPrestigeKerriganAbilitiesStunSearch3",
        "CommanderPrestigeKerriganAbilitiesStunSearch4",
        "CommanderPrestigeKerriganAbilitiesStunSearch5"
      ]
    },
    {
      "path": "GameData/TargetSortData_Kerrigan.xml",
      "owns": [
        "CUnit"
      ],
      "catalogIds": []
    },
    {
      "path": "GameData/UnitData_Kerrigan.xml",
      "owns": [
        "CUnit"
      ],
      "catalogIds": [
        "K5Kerrigan",
        "K5KerriganBurrowed",
        "K5KerriganPsiStrike",
        "KerriganReviveCocoon",
        "Larva",
        "LarvaKerrigan",
        "DroneKerrigan",
        "OverlordKerrigan",
        "OverseerKerrigan",
        "HydraliskKerrigan",
        "HydraliskLurkerKerrigan",
        "HydraliskLurkerBurrowedKerrigan",
        "UltraliskKerrigan",
        "BroodLordKerrigan",
        "BroodLordCocoonKerrigan",
        "HatcheryKerrigan",
        "LairKerrigan",
        "HiveKerrigan",
        "SpireKerrigan",
        "GreaterSpireKerrigan",
        "ExtractorKerrigan",
        "SpawningPoolKerrigan",
        "EvolutionChamberKerrigan",
        "HydraliskDenKerrigan",
        "LurkerDenKerrigan",
        "UltraliskCavernKerrigan",
        "NydusNetworkKerrigan",
        "SpineCrawlerKerrigan",
        "SpineCrawlerUprootedKerrigan",
        "SporeCrawlerKerrigan",
        "SporeCrawlerUprootedKerrigan",
        "NydusCanalKerrigan",
        "GreaterNydusWormKerrigan"
      ]
    },
    {
      "path": "GameData/UpgradeData_Kerrigan.xml",
      "owns": [
        "CUpgrade"
      ],
      "catalogIds": [
        "CommanderPrestigeKerriganAbilities",
        "CommanderPrestigeKerriganAbilitiesMasteryPrimary",
        "CommanderPrestigeKerriganAbilitiesMasteryImmobilizationWave",
        "CommanderPrestigeKerriganAbilitiesPerk",
        "CommanderPrestigeKerriganAssimilationAura",
        "CommanderPrestigeKerriganAssimilationAuraShared",
        "KerriganGhostCosmetic"
      ]
    }
  ],
  "exports": {
    "units": [
      "K5Kerrigan",
      "K5KerriganBurrowed",
      "K5KerriganPsiStrike",
      "KerriganReviveCocoon",
      "Larva",
      "LarvaKerrigan",
      "DroneKerrigan",
      "OverlordKerrigan",
      "OverseerKerrigan",
      "HydraliskKerrigan",
      "HydraliskLurkerKerrigan",
      "HydraliskLurkerBurrowedKerrigan",
      "UltraliskKerrigan",
      "BroodLordKerrigan",
      "BroodLordCocoonKerrigan",
      "HatcheryKerrigan",
      "LairKerrigan",
      "HiveKerrigan",
      "SpireKerrigan",
      "GreaterSpireKerrigan",
      "ExtractorKerrigan",
      "SpawningPoolKerrigan",
      "EvolutionChamberKerrigan",
      "HydraliskDenKerrigan",
      "LurkerDenKerrigan",
      "UltraliskCavernKerrigan",
      "NydusNetworkKerrigan",
      "SpineCrawlerKerrigan",
      "SpineCrawlerUprootedKerrigan",
      "SporeCrawlerKerrigan",
      "SporeCrawlerUprootedKerrigan",
      "NydusCanalKerrigan",
      "GreaterNydusWormKerrigan"
    ],
    "upgrades": [
      "CommanderPrestigeKerriganAbilities",
      "CommanderPrestigeKerriganAbilitiesMasteryPrimary",
      "CommanderPrestigeKerriganAbilitiesMasteryImmobilizationWave",
      "CommanderPrestigeKerriganAbilitiesPerk",
      "CommanderPrestigeKerriganAssimilationAura",
      "CommanderPrestigeKerriganAssimilationAuraShared",
      "KerriganGhostCosmetic"
    ]
  }
}
