{
  "schemaVersion": 1,
  "id": "Commander.Abathur",
  "type": "CommanderDataCenter",
  "gameDataEntry": "Base.SC2Data/GameData.xml",
  "migrationStatus": "complete",
  "spaces": [
    {
      "path": "GameData/AbilData_Abathur.xml",
      "owns": [
        "CAbil"
      ],
      "catalogIds": [
        "EvolveToLeviathan",
        "EvolveToLeviathanMutalisk",
        "EvolveToLeviathanGuardianMP",
        "EvolveToLeviathanDevourer",
        "EvolveToLeviathanViper",
        "LarvaTrainSwarm2",
        "CommanderUnits",
        "TrainQueen",
        "LarvaTrainSwarm",
        "LarvaTrain",
        "AbathurCasterBrainPoolPurchaseReborn",
        "AbathurCasterNeuralTethersPurchaseReborn",
        "AbathurCasterFleshReactorPurchaseReborn",
        "AbathurCasterMimeticMembranePurchaseReborn",
        "AbathurHostRapidIncubationPurchaseReborn",
        "AbathurHostLocustSpeedPurchaseReborn",
        "AbathurHostPressurizedGlandsPurchaseReborn",
        "AbathurDevourerAcidCloudSacsPurchaseReborn",
        "AbathurDevourerCorrosiveGlandsPurchaseReborn",
        "AbathurDevourerStomachOverloadPurchaseReborn",
        "AbathurBroodLordDoubleSacOvipositionPurchaseReborn",
        "AbathurBroodLordThickEmbryoMembranePurchaseReborn",
        "AbathurBroodLordParasiteFrenzyPurchaseReborn",
        "AbathurImpalerArmorPiercingSpinesPurchaseReborn",
        "AbathurImpalerEarthveinGlidePurchaseReborn",
        "AbathurImpalerAftershockImpalePurchaseReborn",
        "AbathurLurkerRiftSpinesPurchaseReborn",
        "AbathurLurkerStalkerGlidePurchaseReborn",
        "AbathurLurkerVenomAmbushPurchaseReborn",
        "AbathurMutaliskExplosiveGlaivePurchaseReborn",
        "AbathurMutaliskViciousGlaivePurchaseReborn",
        "AbathurMutaliskRapidRegenerationPurchaseReborn",
        "AbathurGuardianExtendedSpinesPurchaseReborn",
        "AbathurGuardianCorrosiveBombardmentPurchaseReborn",
        "AbathurGuardianRegenerativeSacsPurchaseReborn",
        "AbathurKrakenAcidBarragePurchaseReborn",
        "AbathurKrakenOsteolyticAcidPurchaseReborn",
        "AbathurKrakenTitanicCarapacePurchaseReborn",
        "HydraliskBroodlings",
        "BanelingSpeed",
        "BanelingNuke",
        "BanelingCreep",
        "BanelingShields",
        "BanelingZerglings",
        "HydraliskCripple",
        "HydraliskMechanical",
        "HydraliskRange",
        "HydraliskMelee",
        "OverlordRadar",
        "OverlordZerglings",
        "OverlordZoomies",
        "OverlordGun",
        "OverlordGirth",
        "RoachlingInfestation",
        "BanelingGestation",
        "MeleeStrain",
        "Kleptomania",
        "AdrenalineOverdose",
        "BileShield",
        "Stealthling",
        "KetamineInfusion",
        "Moonrage",
        "ArmoredCarapace",
        "BrutaliskTramplingCarapacePurchaseReborn",
        "BrutaliskSavageRendPurchaseReborn",
        "BrutaliskFleshRecompositionPurchaseReborn",
        "BaseGasExchange",
        "QueenFleshyAbundancePurchase",
        "QueenNornQueenPurchase",
        "ZergBuild",
        "FastMorphing",
        "MineralEfficiency",
        "VespeneEfficiency",
        "NaturalCamouflage",
        "Cliffjumper",
        "CombatDrone"
      ]
    },
    {
      "path": "GameData/ActorData_Abathur.xml",
      "owns": [
        "CActor"
      ],
      "catalogIds": [
        "BrutaliskAbathur",
        "BrutaliskCocoon",
        "LeviathanCocoon",
        "BrutaliskCocoonDeath",
        "LeviathanCocoonDeath"
      ]
    },
    {
      "path": "GameData/BehaviorData_Abathur.xml",
      "owns": [
        "CBehavior"
      ],
      "catalogIds": [
        "BiomassMaxedMarker",
        "BiomassPassive",
        "BiomassTravelling",
        "BiomassCreated",
        "BiomassBuff1",
        "BiomassBuff10",
        "BiomassBuff100",
        "BiomassBuff10PlusLife",
        "BiomassBuff100PlusLife",
        "AbathurCollectBiomass",
        "BiomassTargetMark",
        "BiomassDisplayToggle"
      ]
    },
    {
      "path": "GameData/EffectData_Abathur.xml",
      "owns": [
        "CEffect"
      ],
      "catalogIds": [
        "BiomassCreatedDummy",
        "BiomassPickupDummy",
        "BiomassPickupImpact",
        "BiomassPickupFullImpact",
        "BiomassPickupMarked",
        "BiomassPickup",
        "BiomassBuff1To10Set",
        "BiomassBuff10To100Set",
        "AbathurCollectBiomassPickup",
        "BiomassPickupLM",
        "BiomassPickupFullLM",
        "BiomassBuff1To10Switch",
        "BiomassBuff10To100Switch",
        "BiomassBuff10Remove10Buff1Add",
        "BiomassBuff1Add1Buff10Add",
        "BiomassBuff100Remove10Buff10Add",
        "BiomassBuff10Add1Buff100Add",
        "BiomassBuff1To10AB",
        "BiomassBuff10To100AB",
        "AbathurCollectBiomassSearch",
        "AbathurBiomassRefundDummy",
        "AbathurBiomassMaxStacksDummy",
        "AbathurBiomassUltimateMaxStacksDummy",
        "GrantBiomass"
      ]
    },
    {
      "path": "GameData/RequirementData_Abathur.xml",
      "owns": [
        "CRequirement"
      ],
      "catalogIds": [
        "BrutaliskMorphAvailable",
        "LeviathanMorphAvailable"
      ]
    },
    {
      "path": "GameData/UnitData_Abathur.xml",
      "owns": [
        "CUnit"
      ],
      "catalogIds": [
        "AbathurLavaWorm",
        "AbathurLocust",
        "CoopCasterAbathur",
        "RavagerAbathur",
        "RavagerAbathurBurrowed",
        "RavagerAbathurCocoon",
        "RavagerVileAbathurCocoon",
        "BrutaliskAbathur",
        "BrutaliskCocoon",
        "BrutaliskCocoonRavager",
        "BrutaliskCocoonRoach",
        "BrutaliskCocoonRoachVile",
        "BrutaliskCocoonQueen",
        "BrutaliskCocoonSwarmhost",
        "BrutaliskCocoonDefiler",
        "LeviathanCocoon",
        "LeviathanCocoonMutalisk",
        "LeviathanCocoonGuardianMP",
        "LeviathanCocoonDevourer",
        "LeviathanCocoonViper",
        "BrutaliskAbathurBurrowed",
        "Larva",
        "LarvaAbathur",
        "SwarmHostMP"
      ]
    },
    {
      "path": "GameData/ValidatorData_Abathur.xml",
      "owns": [
        "CUnit"
      ],
      "catalogIds": []
    }
  ],
  "exports": {
    "units": [
      "AbathurLavaWorm",
      "AbathurLocust",
      "CoopCasterAbathur",
      "RavagerAbathur",
      "RavagerAbathurBurrowed",
      "RavagerAbathurCocoon",
      "RavagerVileAbathurCocoon",
      "BrutaliskAbathur",
      "BrutaliskCocoon",
      "BrutaliskCocoonRavager",
      "BrutaliskCocoonRoach",
      "BrutaliskCocoonRoachVile",
      "BrutaliskCocoonQueen",
      "BrutaliskCocoonSwarmhost",
      "BrutaliskCocoonDefiler",
      "LeviathanCocoon",
      "LeviathanCocoonMutalisk",
      "LeviathanCocoonGuardianMP",
      "LeviathanCocoonDevourer",
      "LeviathanCocoonViper",
      "BrutaliskAbathurBurrowed",
      "Larva",
      "LarvaAbathur",
      "SwarmHostMP"
    ],
    "requirements": [
      "BrutaliskMorphAvailable",
      "LeviathanMorphAvailable"
    ]
  }
}
