{
  "schemaVersion": 1,
  "id": "Commander.RaynorX",
  "type": "CommanderDataCenter",
  "gameDataEntry": "Base.SC2Data/GameData.xml",
  "migrationStatus": "complete",
  "spaces": [
    {
      "path": "GameData/AbilData_RaynorX.xml",
      "owns": [
        "CAbil"
      ],
      "catalogIds": [
        "RaynorXCommandoMarineHangar",
        "UpgradeToOrbitalRaynorX",
        "CommandCenterLiftOffRaynorX",
        "OrbitalLiftOffRaynorX",
        "BarracksLiftOffRaynorX",
        "FactoryLiftOffRaynorX",
        "StarportLiftOffRaynorX",
        "SiegeModeRaynorX",
        "UnsiegeRaynorX",
        "AssaultModeRaynorX",
        "FighterModeRaynorX",
        "RaynorXTechLabMorphToBarracks",
        "RaynorXTechLabMorphToFactory",
        "RaynorXTechLabMorphToStarport",
        "RaynorXTechLabMorphToDetached",
        "RaynorXReactorMorphToBarracks",
        "RaynorXReactorMorphToFactory",
        "RaynorXReactorMorphToStarport",
        "RaynorXReactorMorphToDetached",
        "CommandCenterLandRaynorX",
        "OrbitalCommandLandRaynorX",
        "BarracksLandRaynorX",
        "FactoryLandRaynorX",
        "StarportLandRaynorX",
        "CalldownMULERaynorX",
        "ScannerSweepRaynorX",
        "TerranBuildRaynorX",
        "RaynorXTerranAddOns",
        "BarracksAddOnsRaynorX",
        "FactoryAddOnsRaynorX",
        "StarportAddOnsRaynorX",
        "CommandCenterTrainRaynorX",
        "BarracksTrainRaynorX",
        "FactoryTrainRaynorX",
        "StarportTrainRaynorX",
        "EngineeringBayResearchRaynorX",
        "ArmoryResearchRaynorX",
        "BarracksTechLabResearchRaynorX",
        "FactoryTechLabResearchRaynorX",
        "StarportTechLabResearchRaynorX",
        "SuperStimpackMarineRaynorX"
      ]
    },
    {
      "path": "GameData/RequirementData_RaynorX.xml",
      "owns": [
        "CRequirement"
      ],
      "catalogIds": [
        "HaveRaynorXCommander",
        "NotHaveRaynorXCommander",
        "HaveMarineSuperStimRaynorX",
        "HaveStimpackRaynorX",
        "LearnShieldWallRaynorX",
        "LearnTerranInfantryWeapon5RaynorX",
        "LearnTerranInfantryArmor5RaynorX",
        "LearnTerranVehicleAndShipWeapon5RaynorX",
        "LearnTerranVehicleAndShipArmor5RaynorX",
        "HaveRaynorXCommander",
        "NotHaveRaynorXCommander"
      ]
    },
    {
      "path": "GameData/RequirementNodeData_RaynorX.xml",
      "owns": [
        "CRequirement"
      ],
      "catalogIds": [
        "CountUpgradeRaynorXCommanderCompleteOnly",
        "CountUpgradeMarineSuperStimCompleteOnlyRaynorX",
        "CountUpgradeStimpackCompleteOnlyRaynorX",
        "CountUpgradeShieldWallQueuedOrBetterRaynorX",
        "CountUpgradeTerranInfantryWeaponsLevel4CompleteOnlyRaynorX",
        "CountUpgradeTerranInfantryWeaponsLevel5QueuedOrBetterRaynorX",
        "CountUpgradeTerranInfantryArmorsLevel4CompleteOnlyRaynorX",
        "CountUpgradeTerranInfantryArmorsLevel5QueuedOrBetterRaynorX",
        "CountUpgradeTerranVehicleAndShipWeaponsLevel4CompleteOnlyRaynorX",
        "CountUpgradeTerranVehicleAndShipWeaponsLevel5QueuedOrBetterRaynorX",
        "CountUpgradeTerranVehicleAndShipArmorsLevel4CompleteOnlyRaynorX",
        "CountUpgradeTerranVehicleAndShipArmorsLevel5QueuedOrBetterRaynorX",
        "CountUpgradeRaynorXCommanderCompleteOnly",
        "NotCountUpgradeRaynorXCommanderCompleteOnly",
        "NotCountUpgradeShieldWallQueuedOrBetterRaynorX",
        "NotCountUpgradeTerranInfantryWeaponsLevel5QueuedOrBetterRaynorX",
        "NotCountUpgradeTerranInfantryArmorsLevel5QueuedOrBetterRaynorX",
        "NotCountUpgradeTerranVehicleAndShipWeaponsLevel5QueuedOrBetterRaynorX",
        "NotCountUpgradeTerranVehicleAndShipArmorsLevel5QueuedOrBetterRaynorX",
        "NotCountUpgradeRaynorXCommanderCompleteOnly",
        "AndCountUpgradeTerranInfantryWeaponsLevel4CompleteOnlyNotLevel5RaynorX",
        "AndCountUpgradeTerranInfantryArmorsLevel4CompleteOnlyNotLevel5RaynorX",
        "AndCountUpgradeTerranVehicleAndShipWeaponsLevel4CompleteOnlyNotLevel5RaynorX",
        "AndCountUpgradeTerranVehicleAndShipArmorsLevel4CompleteOnlyNotLevel5RaynorX"
      ]
    },
    {
      "path": "GameData/UnitData_RaynorX.xml",
      "owns": [
        "CUnit"
      ],
      "catalogIds": [
        "CoopAssistCasterRaynorX",
        "CoopCasterRaynorX",
        "MutatorAmonRaynorX",
        "RaynorX",
        "RaynorX01",
        "RaynorXCommando",
        "RaynorXCommandoMarine",
        "RaynorXLab",
        "RaynorXsRaidersDropship",
        "Barracks",
        "Factory",
        "Starport",
        "SCVRaynorX",
        "MarineRaynorX",
        "MedicRaynorX",
        "FirebatRaynorX",
        "MarauderRaynorX",
        "VultureRaynorX",
        "SiegeTankRaynorX",
        "SiegeTankSiegedRaynorX",
        "VikingRaynorX",
        "VikingAssaultRaynorX",
        "BansheeRaynorX",
        "BattlecruiserRaynorX",
        "CommandCenterRaynorX",
        "OrbitalCommandRaynorX",
        "BarracksRaynorX",
        "FactoryRaynorX",
        "StarportRaynorX",
        "CommandCenterFlyingRaynorX",
        "OrbitalCommandFlyingRaynorX",
        "BarracksFlyingRaynorX",
        "FactoryFlyingRaynorX",
        "StarportFlyingRaynorX",
        "TechLabRaynorX",
        "ReactorRaynorX",
        "BarracksTechLabRaynorX",
        "BarracksReactorRaynorX",
        "FactoryTechLabRaynorX",
        "FactoryReactorRaynorX",
        "StarportTechLabRaynorX",
        "StarportReactorRaynorX",
        "SupplyDepotRaynorX",
        "RefineryRaynorX",
        "EngineeringBayRaynorX",
        "BunkerRaynorX",
        "MissileTurretRaynorX",
        "SensorTowerRaynorX",
        "ArmoryRaynorX",
        "FusionCoreRaynorX"
      ]
    },
    {
      "path": "GameData/UpgradeData_RaynorX.xml",
      "owns": [
        "CUpgrade"
      ],
      "catalogIds": [
        "CommanderPrestigeRaynorXAir",
        "CommanderPrestigeRaynorXMechAfterburners",
        "CommanderPrestigeRaynorXBioMarineUpgrade",
        "CommanderPrestigeRaynorXBioFirebatUpgrade",
        "CommanderPrestigeRaynorXBioUpgradeTerranInfantryArmorLevel1",
        "CommanderPrestigeRaynorXBioUpgradeTerranInfantryArmorLevel2",
        "CommanderPrestigeRaynorXBioUpgradeTerranInfantryArmorLevel3",
        "CommanderPrestigeRaynorXBioSuperStim",
        "RaynorXCommander",
        "RaynorXCommanderStimUpgrade",
        "RaynorXCommanderArmorVanadium",
        "RaynorXCommanderMechCostReduction",
        "RaynorXBansheeAirstrike",
        "RaynorXFirebatMedicRange",
        "RaynorXUnlockBattlecruiser",
        "RaynorXCommanderHyperionAdvancedTargetingSystems",
        "RaynorXCommanderTerranWeaponAttackSpeed",
        "CommanderPrestigeRaynorXBio",
        "RaynorXTalentedTerranInfantryArmorLevel1",
        "RaynorXTalentedTerranInfantryArmorLevel2",
        "RaynorXTalentedTerranInfantryArmorLevel3",
        "RaynorXCommander"
      ]
    }
  ],
  "exports": {
    "units": [
      "CoopAssistCasterRaynorX",
      "CoopCasterRaynorX",
      "MutatorAmonRaynorX",
      "RaynorX",
      "RaynorX01",
      "RaynorXCommando",
      "RaynorXCommandoMarine",
      "RaynorXLab",
      "RaynorXsRaidersDropship",
      "Barracks",
      "Factory",
      "Starport",
      "SCVRaynorX",
      "MarineRaynorX",
      "MedicRaynorX",
      "FirebatRaynorX",
      "MarauderRaynorX",
      "VultureRaynorX",
      "SiegeTankRaynorX",
      "SiegeTankSiegedRaynorX",
      "VikingRaynorX",
      "VikingAssaultRaynorX",
      "BansheeRaynorX",
      "BattlecruiserRaynorX",
      "CommandCenterRaynorX",
      "OrbitalCommandRaynorX",
      "BarracksRaynorX",
      "FactoryRaynorX",
      "StarportRaynorX",
      "CommandCenterFlyingRaynorX",
      "OrbitalCommandFlyingRaynorX",
      "BarracksFlyingRaynorX",
      "FactoryFlyingRaynorX",
      "StarportFlyingRaynorX",
      "TechLabRaynorX",
      "ReactorRaynorX",
      "BarracksTechLabRaynorX",
      "BarracksReactorRaynorX",
      "FactoryTechLabRaynorX",
      "FactoryReactorRaynorX",
      "StarportTechLabRaynorX",
      "StarportReactorRaynorX",
      "SupplyDepotRaynorX",
      "RefineryRaynorX",
      "EngineeringBayRaynorX",
      "BunkerRaynorX",
      "MissileTurretRaynorX",
      "SensorTowerRaynorX",
      "ArmoryRaynorX",
      "FusionCoreRaynorX"
    ],
    "upgrades": [
      "CommanderPrestigeRaynorXAir",
      "CommanderPrestigeRaynorXMechAfterburners",
      "CommanderPrestigeRaynorXBioMarineUpgrade",
      "CommanderPrestigeRaynorXBioFirebatUpgrade",
      "CommanderPrestigeRaynorXBioUpgradeTerranInfantryArmorLevel1",
      "CommanderPrestigeRaynorXBioUpgradeTerranInfantryArmorLevel2",
      "CommanderPrestigeRaynorXBioUpgradeTerranInfantryArmorLevel3",
      "CommanderPrestigeRaynorXBioSuperStim",
      "RaynorXCommander",
      "RaynorXCommanderStimUpgrade",
      "RaynorXCommanderArmorVanadium",
      "RaynorXCommanderMechCostReduction",
      "RaynorXBansheeAirstrike",
      "RaynorXFirebatMedicRange",
      "RaynorXUnlockBattlecruiser",
      "RaynorXCommanderHyperionAdvancedTargetingSystems",
      "RaynorXCommanderTerranWeaponAttackSpeed",
      "CommanderPrestigeRaynorXBio",
      "RaynorXTalentedTerranInfantryArmorLevel1",
      "RaynorXTalentedTerranInfantryArmorLevel2",
      "RaynorXTalentedTerranInfantryArmorLevel3",
      "RaynorXCommander"
    ],
    "requirements": [
      "HaveRaynorXCommander",
      "NotHaveRaynorXCommander",
      "HaveMarineSuperStimRaynorX",
      "HaveStimpackRaynorX",
      "LearnShieldWallRaynorX",
      "LearnTerranInfantryWeapon5RaynorX",
      "LearnTerranInfantryArmor5RaynorX",
      "LearnTerranVehicleAndShipWeapon5RaynorX",
      "LearnTerranVehicleAndShipArmor5RaynorX",
      "HaveRaynorXCommander",
      "NotHaveRaynorXCommander"
    ]
  }
}
