{
  "schemaVersion": 1,
  "id": "Commander.Fenix",
  "type": "CommanderDataCenter",
  "gameDataEntry": "Base.SC2Data/GameData.xml",
  "migrationStatus": "complete",
  "spaces": [
    {
      "path": "GameData/UnitData_Fenix.xml",
      "owns": [
        "CUnit"
      ],
      "catalogIds": [
        "AdeptFenix",
        "FenixAltarOfPsiStorms",
        "FenixAltarOfPsiStormsBrokenStage2",
        "FenixClolarionCarrier",
        "FenixClolarionInterceptor",
        "FenixKaldalisZealot",
        "FenixMojoScout",
        "FenixPurificationNova",
        "FenixTaldarinImmortal",
        "FenixTalisAdept",
        "FenixTalisAdeptPhaseShift",
        "FenixWarbringerColossus",
        "SentryFenix",
        "SentryFenixPhasing",
        "SoACasterFenix"
      ]
    }
  ],
  "exports": {
    "units": [
      "AdeptFenix",
      "FenixAltarOfPsiStorms",
      "FenixAltarOfPsiStormsBrokenStage2",
      "FenixClolarionCarrier",
      "FenixClolarionInterceptor",
      "FenixKaldalisZealot",
      "FenixMojoScout",
      "FenixPurificationNova",
      "FenixTaldarinImmortal",
      "FenixTalisAdept",
      "FenixTalisAdeptPhaseShift",
      "FenixWarbringerColossus",
      "SentryFenix",
      "SentryFenixPhasing",
      "SoACasterFenix"
    ]
  }
}
