{
  "schemaVersion": 1,
  "id": "Commander.Alarak",
  "type": "CommanderDataCenter",
  "gameDataEntry": "Base.SC2Data/GameData.xml",
  "migrationStatus": "complete",
  "spaces": [
    {
      "path": "GameData/UnitData_Alarak.xml",
      "owns": [
        "CUnit"
      ],
      "catalogIds": [
        "AlarakChampion",
        "AlarakCoop",
        "AlarakReviveBeacon",
        "AlarakRushPlaceholder",
        "AlarakSupplicantWarpTrainDummy",
        "CoopCasterAlarak"
      ]
    }
  ],
  "exports": {
    "units": [
      "AlarakChampion",
      "AlarakCoop",
      "AlarakReviveBeacon",
      "AlarakRushPlaceholder",
      "AlarakSupplicantWarpTrainDummy",
      "CoopCasterAlarak"
    ]
  }
}
