{
  "$schema": "../scripts/sc2-composer/schema/DataCenter.schema.json",
  "schemaVersion": 1,
  "id": "Capability.SibirensSwarmStoryUtils",
  "type": "CapabilityDataCenter",
  "gameDataEntry": "mpq-internal",
  "migrationStatus": "complete",
  "spaces": [],
  "containerType": "mpq",
  "closureRole": "story-utils"
}
