{
  "schemaVersion": 1,
  "id": "Capability.HexTalents",
  "type": "CapabilityDataCenter",
  "gameDataEntry": "Base.SC2Data/GameData.xml",
  "migrationStatus": "complete",
  "spaces": [
    {
      "path": "GameData/AbilData_HexTalents.xml",
      "owns": [
        "CAbil"
      ],
      "catalogIds": [
        "MULEGather4"
      ]
    },
    {
      "path": "GameData/ActorData_HexTalents.xml",
      "owns": [
        "CActor"
      ],
      "catalogIds": [
        "TNX_MULEParty"
      ]
    },
    {
      "path": "GameData/BehaviorData_HexTalents.xml",
      "owns": [
        "CBehavior"
      ],
      "catalogIds": [
        "TNX_Ability_total",
        "TNX_missingdummy"
      ]
    },
    {
      "path": "GameData/EffectData_HexTalents.xml",
      "owns": [
        "CEffect"
      ],
      "catalogIds": [
        "KerriganSuicideNukeSet"
      ]
    },
    {
      "path": "GameData/UnitData_HexTalents.xml",
      "owns": [
        "CUnit"
      ],
      "catalogIds": [
        "TNX_MULEParty"
      ]
    },
    {
      "path": "GameData/UpgradeData_HexTalents.xml",
      "owns": [
        "CUpgrade"
      ],
      "catalogIds": [
        "TNX_00",
        "TNX_01",
        "TNX_012",
        "TNX_013",
        "TNX_014",
        "TNX_015",
        "TNX_016",
        "TNX_0162",
        "TNX_01622",
        "TNX_017",
        "TNX_0172",
        "TNX_018",
        "TNX_019",
        "TNX_0110",
        "TNX_0111",
        "TNX_01112",
        "TNX_0112",
        "TNX_01122",
        "TNX_0113",
        "TNX_0114",
        "TNX_0115",
        "TNX_0116",
        "TNX_0117",
        "TNX_0118",
        "TNX_0119",
        "TNX_002",
        "TNX_MULEParty_Mine",
        "TalentSmallCoopBuild",
        "TalentTKAntiAir",
        "TNX_yaosai_atk_air",
        "TNX_NovaAirlift",
        "TNX_HornerTurentattackground",
        "TalentReaperAntiAir",
        "TNX_Horner_MassProduct",
        "KerriganBomb",
        "TNX_UnstoppableAlarak",
        "142Alarak",
        "TNX_colossus_atk_air",
        "TalentStetmannBanelingLord",
        "TNX_AinoGary",
        "TalentStukovTimedLifeA",
        "TalentStukovTimedLifeB"
      ]
    }
  ],
  "exports": {
    "units": [
      "TNX_MULEParty"
    ],
    "upgrades": [
      "TNX_00",
      "TNX_01",
      "TNX_012",
      "TNX_013",
      "TNX_014",
      "TNX_015",
      "TNX_016",
      "TNX_0162",
      "TNX_01622",
      "TNX_017",
      "TNX_0172",
      "TNX_018",
      "TNX_019",
      "TNX_0110",
      "TNX_0111",
      "TNX_01112",
      "TNX_0112",
      "TNX_01122",
      "TNX_0113",
      "TNX_0114",
      "TNX_0115",
      "TNX_0116",
      "TNX_0117",
      "TNX_0118",
      "TNX_0119",
      "TNX_002",
      "TNX_MULEParty_Mine",
      "TalentSmallCoopBuild",
      "TalentTKAntiAir",
      "TNX_yaosai_atk_air",
      "TNX_NovaAirlift",
      "TNX_HornerTurentattackground",
      "TalentReaperAntiAir",
      "TNX_Horner_MassProduct",
      "KerriganBomb",
      "TNX_UnstoppableAlarak",
      "142Alarak",
      "TNX_colossus_atk_air",
      "TalentStetmannBanelingLord",
      "TNX_AinoGary",
      "TalentStukovTimedLifeA",
      "TalentStukovTimedLifeB"
    ]
  }
}
